{
  "id": "witch-bag",
  "kind": "item",
  "name": "Witch Bag",
  "summary": "Keeps your gathered items when you leave a server.",
  "trust": "confirmed",
  "sources": [
    "wiki-items"
  ],
  "last_updated": "2026-10-29",
  "category": "trinket",
  "aka": [
    "WitchBag"
  ],
  "effect": "An item saver: everything you collected stays with you if you leave a server."
}
