{
  "id": "blood-dish",
  "kind": "item",
  "name": "Blood Dish",
  "summary": "A dish a vampire has filled with blood. It holds more than a cup.",
  "trust": "confirmed",
  "sources": [
    "tay"
  ],
  "last_updated": "2026-10-28",
  "category": "ingredient",
  "rarity": "common",
  "aka": [
    "Blood bowl"
  ],
  "obtain": [
    {
      "method": "made",
      "items": [
        "dish"
      ],
      "text": "Give an empty [[dish]] to a vampire to fill. The vampire must be Lv 100+."
    }
  ]
}
