{
  "id": "human-blood",
  "kind": "item",
  "name": "Human Blood",
  "summary": "A blood bag of human blood.",
  "trust": "unconfirmed",
  "sources": [
    "wiki-items",
    "wiki-beginner-guide"
  ],
  "last_updated": "2026-10-27",
  "category": "consumable",
  "use": "Drink it to feed, or to finish turning into a vampire."
}
