{
  "id": "colored-fragment",
  "kind": "item",
  "name": "Colored Fragment",
  "summary": "A shard of colour that tints a witch's magic permanently.",
  "trust": "confirmed",
  "sources": [
    "tay"
  ],
  "last_updated": "2026-10-29",
  "category": "ingredient",
  "rarity": "common",
  "aka": [
    "Framente",
    "Fragment"
  ],
  "obtain": [
    {
      "method": "found",
      "text": "Spawns at random across the map."
    }
  ],
  "use": "Comes in violet, black, white, red, green, yellow, cyan, pink, orange or blue."
}
