{
  "id": "human-potion",
  "kind": "item",
  "name": "Human Potion",
  "summary": "Undo your turning and become Human again.",
  "trust": "unconfirmed",
  "sources": [
    "wiki-items",
    "wiki-beginner-guide",
    "wiki-werewolf"
  ],
  "last_updated": "2026-10-27",
  "category": "consumable",
  "aka": [
    "Human dose potion"
  ],
  "effect": "Turns you back into a Human."
}
