{
  "id": "broom",
  "kind": "item",
  "name": "Broom",
  "summary": "A witch's broom, for easier movement.",
  "trust": "confirmed",
  "sources": [
    "wiki-items"
  ],
  "last_updated": "2026-10-28",
  "category": "trinket",
  "effect": "Faster travel.",
  "durability": "while using will drain.*"
}
