{
  "id": "cooking-pot",
  "kind": "item",
  "name": "Cooking Pot",
  "summary": "For cooking the Cook Shop's vegetables.",
  "trust": "confirmed",
  "sources": [
    "wiki-items"
  ],
  "last_updated": "2026-10-28",
  "category": "tool",
  "use": "Must be placed over a campfire to allow cooking."
}
