{
  "id": "wolfsbane-potion",
  "kind": "item",
  "name": "Wolfsbane Potion",
  "summary": "Twenty minutes safe from a werewolf's infection.",
  "trust": "unconfirmed",
  "sources": [
    "wiki-items",
    "discord-2026-10-26"
  ],
  "last_updated": "2026-10-27",
  "category": "consumable",
  "restricted_to": [
    "human"
  ],
  "effect": "Immunity to werewolf infection for 20 minutes. You can't drink another while one is active.",
  "droppable": true
}
