{
  "id": "heart",
  "kind": "item",
  "name": "Heart",
  "summary": "A heart torn from a living chest: a witch's most-used ingredient.",
  "trust": "unconfirmed",
  "sources": [
    "tay",
    "wiki-vampire",
    "wiki-witch"
  ],
  "last_updated": "2026-10-27",
  "category": "ingredient",
  "rarity": "common",
  "effect": "Eating it grants one extra life against a lethal attack.",
  "obtain": [
    {
      "method": "ability",
      "race": "vampire",
      "ability": "Heart Extraction",
      "text": "Lv 150"
    },
    {
      "method": "ability",
      "race": "witch",
      "ability": "Heart Extraction",
      "text": "Lv 100"
    },
    {
      "method": "ability",
      "race": "original-vampire",
      "ability": "Heart Rip"
    }
  ],
  "notes": "The old handbook says to take it from a willing participant."
}
