{
  "id": "silver",
  "kind": "item",
  "name": "Silver",
  "summary": "Silver ore, mined from grey rocks.",
  "trust": "confirmed",
  "sources": [
    "wiki-mining",
    "wiki-items"
  ],
  "last_updated": "2026-10-28",
  "category": "ore",
  "obtain": [
    {
      "method": "mined",
      "text": "Silver rocks have 120 health and yield 1 Silver each. 6 XP."
    }
  ]
}
