{
  "id": "verbena",
  "kind": "item",
  "name": "Verbena",
  "summary": "A flower that grows wild and glows.",
  "trust": "confirmed",
  "sources": [
    "tay",
    "wiki-witch-spells",
    "wiki-witch"
  ],
  "last_updated": "2026-10-28",
  "category": "ingredient",
  "rarity": "common",
  "aka": [
    "Vervain"
  ],
  "obtain": [
    {
      "method": "found",
      "text": "Spawns at random across the map, glowing."
    }
  ]
}
