{
  "id": "coal",
  "kind": "item",
  "name": "Coal",
  "summary": "Black ore, burnt as fuel at the forge.",
  "trust": "confirmed",
  "sources": [
    "wiki-mining"
  ],
  "last_updated": "2026-10-28",
  "category": "ore",
  "obtain": [
    {
      "method": "mined",
      "text": "Coal rocks have 50 health and yield 1 Coal each. 3 XP."
    }
  ]
}
